[
  {
    "finding_id": "finding_0001",
    "job_id": "job_mlkem768_liboqs_liboqs_mlkem768_wrapper_generic_vs_pqclean_pqclean_mlkem768_clean",
    "pair_id": "mlkem768_liboqs_liboqs_mlkem768_wrapper_generic_vs_pqclean_pqclean_mlkem768_clean",
    "family": "ML-KEM",
    "parameter_set": "768",
    "primitive_type": "kem",
    "oracle_mode": "kem_cross_impl_shared_semantics",
    "mismatch_type": "shared_secret_mismatch",
    "input_file": "workspace/crashes/job_mlkem768_liboqs_liboqs_mlkem768_wrapper_generic_vs_pqclean_pqclean_mlkem768_clean/crash-0001.input",
    "left_project_id": "liboqs",
    "right_project_id": "pqclean",
    "details": {
      "left_return": 0,
      "right_return": 0,
      "left_ss_hex": "00",
      "right_ss_hex": "ff"
    }
  },
  {
    "finding_id": "finding_0002",
    "job_id": "job_mldsa65_liboqs_liboqs_mldsa65_wrapper_generic_vs_pqclean_pqclean_mldsa65_clean",
    "pair_id": "mldsa65_liboqs_liboqs_mldsa65_wrapper_generic_vs_pqclean_pqclean_mldsa65_clean",
    "family": "ML-DSA",
    "parameter_set": "65",
    "primitive_type": "sig",
    "oracle_mode": "sig_cross_impl_verify_semantics",
    "mismatch_type": "cross_verify_failure",
    "input_file": "workspace/crashes/job_mldsa65_liboqs_liboqs_mldsa65_wrapper_generic_vs_pqclean_pqclean_mldsa65_clean/crash-0001.input",
    "left_project_id": "liboqs",
    "right_project_id": "pqclean",
    "details": {
      "left_verify": 0,
      "right_verify": 1,
      "message_hex": "deadbeef"
    }
  }
]
